{
  "x-osdu-license": "Copyright 2026, The Open Group \\nLicensed under the Apache License, Version 2.0 (the \"License\"); you may not use this file except in compliance with the License. You may obtain a copy of the License at http://www.apache.org/licenses/LICENSE-2.0 . Unless required by applicable law or agreed to in writing, software distributed under the License is distributed on an \"AS IS\" BASIS, WITHOUT WARRANTIES OR CONDITIONS OF ANY KIND, either express or implied. See the License for the specific language governing permissions and limitations under the License.",
  "$id": "https://schema.osdu.opengroup.org/json/work-product-component/GenericBinGrid.1.0.0.json",
  "$schema": "http://json-schema.org/draft-07/schema#",
  "x-osdu-schema-source": "osdu:wks:work-product-component--GenericBinGrid:1.0.0",
  "title": "GenericBinGrid",
  "description": "The properties for a generic bin grid.",
  "type": "object",
  "properties": {
    "id": {
      "description": "Previously called ResourceID or SRN which identifies this OSDU resource object without version.",
      "title": "Entity ID",
      "type": "string",
      "pattern": "^[\\w\\-\\.]+:work-product-component\\-\\-GenericBinGrid:[\\w\\-\\.\\:\\%]+$",
      "example": "namespace:work-product-component--GenericBinGrid:c8f205fc-2912-5fe0-8d64-191ec53d3061"
    },
    "kind": {
      "description": "The schema identification for the OSDU resource object following the pattern {Namespace}:{Source}:{Type}:{VersionMajor}.{VersionMinor}.{VersionPatch}. The versioning scheme follows the semantic versioning, https://semver.org/.",
      "title": "Entity Kind",
      "type": "string",
      "pattern": "^[\\w\\-\\.]+:[\\w\\-\\.]+:[\\w\\-\\.]+:[0-9]+.[0-9]+.[0-9]+$",
      "example": "osdu:wks:work-product-component--GenericBinGrid:1.0.0"
    },
    "version": {
      "description": "The version number of this OSDU resource; set by the framework.",
      "title": "Version Number",
      "type": "integer",
      "format": "int64",
      "example": 1562066009929332
    },
    "acl": {
      "description": "The access control tags associated with this entity.",
      "title": "Access Control List",
      "$ref": "../abstract/AbstractAccessControlList.1.0.0.json"
    },
    "legal": {
      "description": "The entity's legal tags and compliance status. The actual contents associated with the legal tags is managed by the Compliance Service.",
      "title": "Legal Tags",
      "$ref": "../abstract/AbstractLegalTags.1.0.0.json"
    },
    "tags": {
      "title": "Tag Dictionary",
      "description": "A generic dictionary of string keys mapping to string value. Only strings are permitted as keys and values.",
      "type": "object",
      "additionalProperties": {
        "type": "string"
      },
      "example": {
        "NameOfKey": "String value"
      }
    },
    "createTime": {
      "description": "Timestamp of the time at which initial version of this OSDU resource object was created. Set by the System. The value is a combined date-time string in ISO-8601 given in UTC.",
      "title": "Resource Object Creation DateTime",
      "type": "string",
      "format": "date-time",
      "example": "2020-12-16T11:46:20.163Z"
    },
    "createUser": {
      "title": "Resource Object Creation User Reference",
      "description": "The user reference, which created the first version of this resource object. Set by the System.",
      "type": "string",
      "example": "some-user@some-company-cloud.com"
    },
    "modifyTime": {
      "description": "Timestamp of the time at which this version of the OSDU resource object was created. Set by the System. The value is a combined date-time string in ISO-8601 given in UTC.",
      "title": "Resource Object Version Creation DateTime",
      "type": "string",
      "format": "date-time",
      "example": "2020-12-16T11:52:24.477Z"
    },
    "modifyUser": {
      "title": "Resource Object Version Creation User Reference",
      "description": "The user reference, which created this version of this resource object. Set by the System.",
      "type": "string",
      "example": "some-user@some-company-cloud.com"
    },
    "ancestry": {
      "description": "The links to data, which constitute the inputs, from which this record instance is derived.",
      "title": "Ancestry",
      "$ref": "../abstract/AbstractLegalParentList.1.0.0.json"
    },
    "meta": {
      "description": "The Frame of Reference meta data section linking the named properties to self-contained definitions.",
      "title": "Frame of Reference Meta Data",
      "type": "array",
      "items": {
        "$ref": "../abstract/AbstractMetaItem.1.0.0.json"
      }
    },
    "data": {
      "allOf": [
        {
          "$ref": "../abstract/AbstractCommonResources.1.0.0.json"
        },
        {
          "$ref": "../abstract/AbstractWPCGroupType.1.2.0.json"
        },
        {
          "$ref": "../abstract/AbstractWorkProductComponent.1.1.0.json"
        },
        {
          "$ref": "../abstract/AbstractGenericBinGrid.1.0.0.json"
        },
        {
          "type": "object",
          "properties": {},
          "title": "IndividualProperties"
        },
        {
          "type": "object",
          "properties": {
            "ExtensionProperties": {
              "type": "object"
            }
          },
          "title": "ExtensionProperties"
        }
      ]
    }
  },
  "required": [
    "kind",
    "acl",
    "legal"
  ],
  "additionalProperties": false,
  "x-osdu-review-status": "Accepted",
  "x-osdu-virtual-properties": {
    "data.VirtualProperties.DefaultLocation": {
      "type": "object",
      "priority": [
        {
          "path": "data.SpatialArea"
        },
        {
          "path": "data.ABCDBinGridSpatialLocation"
        },
        {
          "path": "data.SpatialPoint"
        }
      ]
    },
    "data.VirtualProperties.DefaultName": {
      "type": "string",
      "priority": [
        {
          "path": "data.Name"
        }
      ]
    }
  },
  "x-osdu-inheriting-from-kind": [
    {
      "name": "WorkProductComponent",
      "kind": "osdu:wks:AbstractWPCGroupType:1.2.0"
    }
  ]
}