{
  "acl": {
    "owners": [
      "data.default.owners@dev.dataservices.energy"
    ],
    "viewers": [
      "data.default.viewers@dev.dataservices.energy"
    ]
  },
  "kind": "osdu:wks:work-product-component--LocalBoundaryFeature:1.2.0",
  "legal": {
    "legaltags": [
      "dev-equinor-private-default"
    ],
    "otherRelevantDataCountries": [
      "NO"
    ]
  },
  "createTime": "2025-11-18T14:16:00.000Z",
  "createUser": "maap",
  "id": "dev:work-product-component--LocalBoundaryFeature:cbabefad-789c-4327-9aaf-e36c31288efb",
  "modifyTime": "2025-11-18T14:16:00.000Z",
  "modifyUser": "maap",
  "version": 1,
  "data": {
    "ExistenceKind": "dev:reference-data--ExistenceKind:Prototype:",
    "DDMSDatasets": [
      "eml://reservoir-ddms1/dataspace('maap/drogon')/resqml20.obj_GeneticBoundaryFeature(cbabefad-789c-4327-9aaf-e36c31288efb)"
    ],
    "IsDiscoverable": true,
    "IsExtendedLoad": false,
    "CreationDateTime": "2025-11-18T14:16:00.000Z",
    "Name": "BaseVolantis",
    "SpatialPoint": {
      "AsIngestedCoordinates": {
        "features": [
          {
            "type": "AnyCrsFeature",
            "geometry": {
              "type": "AnyCrsPoint",
              "coordinates": [
                6421.150390625,
                -3119.97998046875
              ]
            },
            "properties": {}
          }
        ],
        "persistableReferenceCrs": "",
        "type": "AnyCrsFeatureCollection"
      }
    },
    "SubmitterName": "MAAP@equinor.com"
  }
}
