{
  "id": "dev:work-product-component--HorizonInterpretation:03117bea-4fe0-5b84-968a-0d54a6542cd9:1",
  "kind": "osdu:wks:work-product-component--HorizonInterpretation:1.2.0",
  "acl": {
    "owners": [
      "data.default.owners@dev.dataservices.energy"
    ],
    "viewers": [
      "data.office.global.viewers@dev.dataservices.energy"
    ]
  },
  "legal": {
    "legaltags": [
      "dev-equinor-private-default"
    ],
    "otherRelevantDataCountries": [
      "NO"
    ]
  },
  "data": {
    "Name": "TopTherys Interpretation",
    "Description": "Top Therys source rock",
    "FeatureID": "dev:master-data--LocalBoundaryFeature:1d4abdc7-ce6e-5f8f-9afc-2bacd2205ed7:1",
    "FeatureName": "Top Therys",
    "DomainTypeID": "dev:reference-data--DomainType:Mixed:",
    "StratigraphicRoleTypeID": "dev:reference-data--StratigraphicRoleType:MFS:",
    "MeanPossibleAge": 155.0,
    "ancestry": {
      "parents": [
        "dev:master-data--LocalBoundaryFeature:1d4abdc7-ce6e-5f8f-9afc-2bacd2205ed7:1"
      ]
    }
  }
}
