{
  "id": "dev:work-product-component--StructureMap:60659fb4-8f12-5521-bfc9-39ccde2e9360:1",
  "kind": "osdu:wks:work-product-component--StructureMap:1.0.0",
  "acl": {
    "owners": [
      "data.default.owners@dev.dataservices.energy"
    ],
    "viewers": [
      "data.office.global.viewers@dev.dataservices.energy"
    ]
  },
  "legal": {
    "legaltags": [
      "dev-equinor-private-default"
    ],
    "otherRelevantDataCountries": [
      "NO"
    ]
  },
  "data": {
    "Name": "TopVolantis Depth Map (inline 25 m grid)",
    "Description": "Depth structure map for Top Volantis reservoir - same 25 m grid as the shared GenericBinGrid but embedded inline (Pattern A)",
    "InterpretationID": "dev:work-product-component--HorizonInterpretation:1c979d9c-7177-57f0-b085-df09c17a30b9:1",
    "InterpretationName": "TopVolantis Interpretation",
    "SeismicHorizonID": "dev:work-product-component--SeismicHorizon:aabe28f7-a859-5651-a736-02815f8b9385:1",
    "DomainTypeID": "dev:reference-data--DomainType:Depth:",
    "BinGridName": "TopVolantis inline depth grid",
    "ABCDBinGridSpatialLocation": {
      "AsIngestedCoordinates": {
        "type": "FeatureCollection",
        "CoordinateReferenceSystemID": "dev:reference-data--CoordinateReferenceSystem:BoundCRS:EPSG::23031_EPSG::5714:",
        "features": [
          {
            "type": "Feature",
            "geometry": {
              "type": "MultiPoint",
              "coordinates": [
                [
                  461000.0,
                  6782000.0
                ],
                [
                  461000.0,
                  6774525.0
                ],
                [
                  465975.0,
                  6774525.0
                ],
                [
                  465975.0,
                  6782000.0
                ]
              ]
            },
            "properties": {
              "name": "ABCD corners"
            }
          }
        ]
      }
    },
    "OriginEasting": 461000.0,
    "OriginNorthing": 6782000.0,
    "BinWidthOnIaxis": 25.0,
    "BinWidthOnJaxis": 25.0,
    "MapGridBearingOfBinGridJaxis": 90.0,
    "NodeCountOnIAxis": 300,
    "NodeCountOnJAxis": 200,
    "TransformationMethod": 9666,
    "IndexableElementCount": [
      {
        "Count": 60000,
        "IndexableElementID": "dev:reference-data--IndexableElement:Cells:"
      },
      {
        "Count": 60501,
        "IndexableElementID": "dev:reference-data--IndexableElement:Nodes:"
      }
    ],
    "GenericRepresentationID": "dev:work-product-component--GenericRepresentation:f857c36c-3939-4ff3-9125-a11cf2af105c:1",
    "DDMSDatasets": [
      "eml://reservoir-ddms1/dataspace('maap/drogon')/resqml20.obj_Grid2dRepresentation('f857c36c-3939-4ff3-9125-a11cf2af105c')"
    ],
    "ancestry": {
      "parents": [
        "dev:work-product-component--SeismicHorizon:aabe28f7-a859-5651-a736-02815f8b9385:1",
        "dev:work-product-component--HorizonInterpretation:1c979d9c-7177-57f0-b085-df09c17a30b9:1",
        "dev:master-data--LocalBoundaryFeature:804f5d22-1412-57a7-9074-9271bea930e7:1",
        "dev:work-product-component--GenericRepresentation:f857c36c-3939-4ff3-9125-a11cf2af105c:1"
      ]
    },
    "Source": "maap@equinor.com"
  }
}
