{
  "id": "dev:master-data--ReservoirSegment:98b0c0d4-2c5d-4c94-b8c3-d7e41bf933f9:1",
  "kind": "osdu:wks:master-data--ReservoirSegment:2.0.0",
  "acl": {
    "owners": [
      "data.default.owners@dev.dataservices.energy"
    ],
    "viewers": [
      "data.office.global.viewers@dev.dataservices.energy"
    ]
  },
  "legal": {
    "legaltags": [
      "dev-equinor-private-default"
    ],
    "otherRelevantDataCountries": [
      "NO"
    ]
  },
  "data": {
    "Name": "Central Horst",
    "Description": "Central horst block of the Valysar formation, Drogon field — largest oil accumulation",
    "ancestry": {
      "parents": [
        "dev:master-data--Reservoir:5b8dc759-4be9-493a-9bd3-eb0e55fd078e:1"
      ],
      "children": []
    }
  }
}