{
  "id": "dev:master-data--ReservoirSegment:b47e81f4-c545-4f8d-ab45-4b9585cfeebb:1",
  "kind": "osdu:wks:master-data--ReservoirSegment:2.0.0",
  "acl": {
    "owners": [
      "data.default.owners@dev.dataservices.energy"
    ],
    "viewers": [
      "data.office.global.viewers@dev.dataservices.energy"
    ]
  },
  "legal": {
    "legaltags": [
      "dev-equinor-private-default"
    ],
    "otherRelevantDataCountries": [
      "NO"
    ]
  },
  "data": {
    "Name": "East Lowland",
    "Description": "Eastern lowland fault block of the Valysar formation, Drogon field",
    "ancestry": {
      "parents": [
        "dev:master-data--Reservoir:5b8dc759-4be9-493a-9bd3-eb0e55fd078e:1"
      ],
      "children": []
    }
  }
}