{
  "acl": {
    "owners": [
      "data.default.owners@dev.dataservices.energy"
    ],
    "viewers": [
      "data.default.viewers@dev.dataservices.energy"
    ]
  },
  "kind": "osdu:wks:work-product-component--LocalBoundaryFeature:1.2.0",
  "legal": {
    "legaltags": [
      "dev-equinor-private-default"
    ],
    "otherRelevantDataCountries": [
      "NO"
    ]
  },
  "createTime": "2024-11-11T12:08:00.000Z",
  "createUser": "knutm",
  "id": "dev:work-product-component--LocalBoundaryFeature:333323bf-2839-4628-b5d2-37463a10ba89",
  "modifyTime": "2024-11-11T12:08:00.000Z",
  "modifyUser": "dalsaab",
  "version": 1,
  "data": {
    "ExistenceKind": "dev:reference-data--ExistenceKind:Prototype:",
    "DDMSDatasets": [
      "eml://reservoir-ddms1/dataspace('maap/drogon')/resqml20.obj_GeneticBoundaryFeature(333323bf-2839-4628-b5d2-37463a10ba89)"
    ],
    "IsDiscoverable": true,
    "IsExtendedLoad": false,
    "CreationDateTime": "2024-11-11T12:08:00.000Z",
    "Name": "BaseVolantis",
    "SpatialPoint": {
      "AsIngestedCoordinates": {
        "features": [
          {
            "type": "AnyCrsFeature",
            "geometry": {
              "type": "AnyCrsPoint",
              "coordinates": [
                6421.150390625,
                -3119.97998046875
              ]
            },
            "properties": {}
          }
        ],
        "persistableReferenceCrs": "",
        "type": "AnyCrsFeatureCollection"
      }
    },
    "SubmitterName": "MAAP@equinor.com"
  }
}
