{
  "acl": {
    "owners": [
      "data.default.owners@dev.dataservices.energy"
    ],
    "viewers": [
      "data.default.viewers@dev.dataservices.energy"
    ]
  },
  "kind": "osdu:wks:work-product-component--HorizonInterpretation:1.2.0",
  "legal": {
    "legaltags": [
      "dev-equinor-private-default"
    ],
    "otherRelevantDataCountries": [
      "NO"
    ]
  },
  "createTime": "2025-11-18T14:16:00.000Z",
  "createUser": "maap",
  "id": "dev:work-product-component--HorizonInterpretation:d2eb24a4-a9fb-429d-bdc8-574bb6f07f87",
  "modifyTime": "2025-11-18T14:16:00.000Z",
  "modifyUser": "maap",
  "version": 1,
  "data": {
    "ExistenceKind": "dev:reference-data--ExistenceKind:Prototype:",
    "DDMSDatasets": [
      "eml://reservoir-ddms1/dataspace('maap/drogon')/resqml20.obj_HorizonInterpretation(d2eb24a4-a9fb-429d-bdc8-574bb6f07f87)"
    ],
    "IsDiscoverable": true,
    "IsExtendedLoad": false,
    "CreationDateTime": "2025-11-18T14:16:00.000Z",
    "Name": "TopVolantis",
    "SpatialPoint": {
      "AsIngestedCoordinates": {
        "features": [
          {
            "type": "AnyCrsFeature",
            "geometry": {
              "type": "AnyCrsPoint",
              "coordinates": [
                6421.150390625,
                -3119.97998046875
              ]
            },
            "properties": {}
          }
        ],
        "persistableReferenceCrs": "",
        "type": "AnyCrsFeatureCollection"
      }
    },
    "SubmitterName": "MAAP@equinor.com",
    "DomainTypeID": "dev:reference-data--DomainType:Depth:",
    "FeatureID": "dev:work-product-component--LocalBoundaryFeature:572c356a-73f8-4f09-a575-02e10a087bfc:",
    "FeatureName": "TopVolantis",
    "StratigraphicRoleTypeID": "dev:reference-data--StratigraphicRoleType:Chronostratigraphic:"
  }
}
