{
  "id": "dev:work-product-component--StructureMap:45f7bda8-b755-5c17-8a83-b286e7f0d116:1",
  "kind": "osdu:wks:work-product-component--StructureMap:1.0.0",
  "acl": {
    "owners": [
      "data.default.owners@dev.dataservices.energy"
    ],
    "viewers": [
      "data.office.global.viewers@dev.dataservices.energy"
    ]
  },
  "legal": {
    "legaltags": [
      "dev-equinor-private-default"
    ],
    "otherRelevantDataCountries": [
      "NO"
    ]
  },
  "data": {
    "Name": "TopTherys Depth Map (standalone)",
    "Description": "Depth structure map with inline grid for Top Therys source rock",
    "InterpretationID": "dev:work-product-component--HorizonInterpretation:03117bea-4fe0-5b84-968a-0d54a6542cd9:1",
    "InterpretationName": "TopTherys Interpretation",
    "SeismicHorizonID": "dev:work-product-component--SeismicHorizon:7f4ba05a-1e04-5fa7-8883-307c8b7b490b:1",
    "CrsID": "dev:reference-data--CoordinateReferenceSystem:BoundCRS:EPSG::23031_EPSG::5714:",
    "DomainTypeID": "dev:reference-data--DomainType:Depth:",
    "BinGridName": "TopTherys inline grid",
    "ABCDBinGridSpatialLocation": {
      "AsIngestedCoordinates": {
        "type": "FeatureCollection",
        "CoordinateReferenceSystemID": "dev:reference-data--CoordinateReferenceSystem:BoundCRS:EPSG::23031_EPSG::5714:",
        "features": [
          {
            "type": "Feature",
            "geometry": {
              "type": "MultiPoint",
              "coordinates": [
                [
                  461500.0,
                  6782500.0
                ],
                [
                  461500.0,
                  6775050.0
                ],
                [
                  466450.0,
                  6775050.0
                ],
                [
                  466450.0,
                  6782500.0
                ]
              ]
            },
            "properties": {
              "name": "ABCD corners"
            }
          }
        ]
      }
    },
    "OriginEasting": 461500.0,
    "OriginNorthing": 6782500.0,
    "BinWidthOnIaxis": 50.0,
    "BinWidthOnJaxis": 50.0,
    "MapGridBearingOfBinGridJaxis": 90.0,
    "NodeCountOnIAxis": 150,
    "NodeCountOnJAxis": 100,
    "TransformationMethod": 9666,
    "IndexableElementCount": [
      {
        "Count": 15000,
        "IndexableElementID": "dev:reference-data--IndexableElement:Cells:"
      },
      {
        "Count": 15251,
        "IndexableElementID": "dev:reference-data--IndexableElement:Nodes:"
      }
    ],
    "DDMSDatasets": [
      "eml://rddms-1/dataspace('demo/volantis-interp')/resqml20.obj_Grid2dRepresentation('b5274807-83d6-53fa-97e1-ac774771c688')"
    ],
    "ancestry": {
      "parents": [
        "dev:work-product-component--SeismicHorizon:7f4ba05a-1e04-5fa7-8883-307c8b7b490b:1",
        "dev:work-product-component--HorizonInterpretation:03117bea-4fe0-5b84-968a-0d54a6542cd9:1",
        "dev:master-data--LocalBoundaryFeature:1d4abdc7-ce6e-5f8f-9afc-2bacd2205ed7:1"
      ]
    }
  }
}
