{
  "id": "dev:master-data--Risk:Drogon-PorosityAndCementation:1",
  "kind": "osdu:wks:master-data--Risk:1.2.0",
  "acl": {
    "owners": [
      "data.default.owners@dev.dataservices.energy"
    ],
    "viewers": [
      "data.office.global.viewers@dev.dataservices.energy"
    ]
  },
  "legal": {
    "legaltags": [
      "dev-equinor-private-default"
    ],
    "otherRelevantDataCountries": [
      "NO"
    ]
  },
  "data": {
    "Name": "Drogon — Porosity and cementation uncertainty",
    "Summary": "Porosity and cementation quality in the Valysar fluvial deposits drive uncertainty in pore volume and hydrocarbon recovery.",
    "Description": "The Valysar fluvial system shows significant facies-dependent porosity variation (Floodplain ~0.10, Channel ~0.28, Crevasse ~0.21). Cementation and diagenetic effects further reduce effective porosity, particularly in the deeper segments. This risk affects volumetric estimates (BulkOil, PoreOil, HydrocarbonPoreOil) and recovery factor across all 7 reservoir segments.\n\nKey Uncertainty — Facies-dependent porosity [High]: Porosity varies 0.10–0.28 across facies; Channel-dominant segments (CentralHorst) have higher confidence than Floodplain-rich segments (NorthSea, EastLobe).\n\nKey Uncertainty — Cementation and diagenesis [Medium]: Deeper segments show evidence of diagenetic cementation reducing effective porosity and permeability, particularly in Crevasse facies.",
    "TypeID": "osdu:wks:reference-data--RiskType:risk:1.0.0",
    "EffectiveDateTime": "2026-02-13T00:00:00Z",
    "ext": {
      "equinor": {
        "CategoryID": "dev:reference-data--RiskCategory:Subsurface-Static:1",
        "SeverityScaleID": "dev:reference-data--RiskSeverityScale:Equinor-5x5:1",
        "ProbabilityScaleID": "dev:reference-data--RiskProbabilityScale:Equinor-5x5:1",
        "RiskAcceptanceCriteriaID": "dev:reference-data--RiskAcceptanceCriteria:RAC-2025-01:1",
        "InherentSeverity": "S3",
        "InherentProbability": "P4",
        "ResidualSeverity": "S2",
        "ResidualProbability": "P3",
        "AcceptedAsIs": false,
        "Status": "Open",
        "MitigationActionIDs": [],
        "UncertaintyImpact": "High"
      }
    }
  }
}