{
  "id": "dev:master-data--LocalBoundaryFeature:804f5d22-1412-57a7-9074-9271bea930e7:1",
  "kind": "osdu:wks:master-data--LocalBoundaryFeature:1.1.0",
  "acl": {
    "owners": [
      "data.default.owners@dev.dataservices.energy"
    ],
    "viewers": [
      "data.office.global.viewers@dev.dataservices.energy"
    ]
  },
  "legal": {
    "legaltags": [
      "dev-equinor-private-default"
    ],
    "otherRelevantDataCountries": [
      "NO"
    ]
  },
  "data": {
    "Name": "Top Volantis",
    "Description": "Top Volantis reservoir",
    "FeatureTypeID": "dev:reference-data--FeatureType:BoundaryFeature:",
    "ancestry": {
      "parents": []
    }
  }
}
