{
  "id": "dev:work-product-component--SeismicHorizon:aabe28f7-a859-5651-a736-02815f8b9385:1",
  "kind": "osdu:wks:work-product-component--SeismicHorizon:2.1.0",
  "acl": {
    "owners": [
      "data.default.owners@dev.dataservices.energy"
    ],
    "viewers": [
      "data.office.global.viewers@dev.dataservices.energy"
    ]
  },
  "legal": {
    "legaltags": [
      "dev-equinor-private-default"
    ],
    "otherRelevantDataCountries": [
      "NO"
    ]
  },
  "data": {
    "Name": "TopVolantis TWT",
    "Description": "TWT horizon pick for Top Volantis reservoir",
    "InterpretationID": "dev:work-product-component--HorizonInterpretation:1c979d9c-7177-57f0-b085-df09c17a30b9:1",
    "InterpretationName": "TopVolantis Interpretation",
    "BinGridID": "dev:work-product-component--SeismicBinGrid:543679ee-28fe-57c5-8b50-9ba4eedfddf7:1",
    "DomainTypeID": "dev:reference-data--DomainType:Time:",
    "RepresentationType": "dev:reference-data--RepresentationType:Regular2DGrid:",
    "SeismicHorizonTypeID": "dev:reference-data--SeismicHorizonType:Peak:",
    "PetroleumSystemElementTypeID": "dev:reference-data--PetroleumSystemElementType:Reservoir:",
    "Interpreter": "Volantis Interpretation Team",
    "Remark": [
      {
        "Remark": "Picked on Volantis3D survey, nominal TWT 1850 ms"
      }
    ],
    "IndexableElementCount": [
      {
        "Count": 240000,
        "IndexableElementID": "dev:reference-data--IndexableElement:Cells:"
      },
      {
        "Count": 241001,
        "IndexableElementID": "dev:reference-data--IndexableElement:Nodes:"
      }
    ],
    "DDMSDatasets": [
      "eml://rddms-1/dataspace('maap/drogon')/resqml20.obj_Grid2dRepresentation('9deb9074-c4eb-44ff-990a-229bb545d442')"
    ],
    "ancestry": {
      "parents": [
        "dev:work-product-component--HorizonInterpretation:1c979d9c-7177-57f0-b085-df09c17a30b9:1",
        "dev:work-product-component--SeismicBinGrid:543679ee-28fe-57c5-8b50-9ba4eedfddf7:1",
        "dev:master-data--LocalBoundaryFeature:804f5d22-1412-57a7-9074-9271bea930e7:1"
      ]
    }
  }
}
